{
  "schemaVersion": 1,
  "eventId": "00000000-0000-0000-0000-000000000066",
  "source": "IDENTITY_SERVICE",
  "eventType": "ACCOUNT_PROVISIONED",
  "aggregateType": "ACCOUNT",
  "aggregateId": "ACC001",
  "aggregateVersion": 1,
  "occurredAt": "2026-10-01T10:00:01Z",
  "correlationId": "test-correlation",
  "causationId": "CMD001",
  "payload": {
    "accountId": "ACC001",
    "role": "CUSTOMER",
    "profileId": "CUS001",
    "registrationOperationId": "REG001"
  }
}
